productId,name
1,WHITE HANGING HEART T-LIGHT HOLDER
2,WHITE METAL LANTERN
3,CREAM CUPID HEARTS COAT HANGER
4,KNITTED UNION FLAG HOT WATER BOTTLE
5,RED WOOLLY HOTTIE WHITE HEART.
6,SET 7 BABUSHKA NESTING BOXES
7,GLASS STAR FROSTED T-LIGHT HOLDER
8,HAND WARMER UNION JACK
9,HAND WARMER RED POLKA DOT
10,ASSORTED COLOUR BIRD ORNAMENT
11,POPPY'S PLAYHOUSE BEDROOM 
12,POPPY'S PLAYHOUSE KITCHEN
13,FELTCRAFT PRINCESS CHARLOTTE DOLL
14,IVORY KNITTED MUG COSY 
15,BOX OF 6 ASSORTED COLOUR TEASPOONS
16,BOX OF VINTAGE JIGSAW BLOCKS 
17,BOX OF VINTAGE ALPHABET BLOCKS
18,HOME BUILDING BLOCK WORD
19,LOVE BUILDING BLOCK WORD
20,RECIPE BOX WITH METAL HEART
21,DOORMAT NEW ENGLAND
22,JAM MAKING SET WITH JARS
23,RED COAT RACK PARIS FASHION
24,YELLOW COAT RACK PARIS FASHION
25,BLUE COAT RACK PARIS FASHION
26,BATH BUILDING BLOCK WORD
27,ALARM CLOCK BAKELIKE PINK
28,ALARM CLOCK BAKELIKE RED 
29,ALARM CLOCK BAKELIKE GREEN
30,PANDA AND BUNNIES STICKER SHEET
31,STARS GIFT TAPE 
32,INFLATABLE POLITICAL GLOBE 
34,VINTAGE HEADS AND TAILS CARD GAME 
36,SET/2 RED RETROSPOT TEA TOWELS 
38,ROUND SNACK BOXES SET OF4 WOODLAND 
39,SPACEBOY LUNCH BOX 
40,LUNCH BOX I LOVE LONDON
41,CIRCUS PARADE LUNCH BOX 
42,CHARLOTTE BAG DOLLY GIRL DESIGN
43,RED TOADSTOOL LED NIGHT LIGHT
44, SET 2 TEA TOWELS I LOVE LONDON 
45,VINTAGE SEASIDE JIGSAW PUZZLES
46,MINI JIGSAW CIRCUS PARADE 
47,MINI JIGSAW SPACEBOY
48,MINI PAINT SET VINTAGE 
49,POSTAGE
50,PAPER CHAIN KIT 50'S CHRISTMAS 
52,EDWARDIAN PARASOL RED
53,RETRO COFFEE MUGS ASSORTED
54,SAVE THE PLANET MUG
55,VINTAGE BILLBOARD DRINK ME MUG
57,VINTAGE BILLBOARD LOVE/HATE MUG
58,WOOD 2 DRAWER CABINET WHITE FINISH
60,WOOD S/3 CABINET ANT WHITE FINISH
61,WOODEN PICTURE FRAME WHITE FINISH
62,WOODEN FRAME ANTIQUE WHITE 
63,VICTORIAN SEWING BOX LARGE
64,HOT WATER BOTTLE TEA AND SYMPATHY
65,RED HANGING HEART T-LIGHT HOLDER
66,JUMBO BAG PINK POLKADOT
68,JUMBO  BAG BAROQUE BLACK WHITE
69,JUMBO BAG CHARLIE AND LOLA TOYS
70,STRAWBERRY CHARLOTTE BAG
71,RED 3 PIECE RETROSPOT CUTLERY SET
72,BLUE 3 PIECE POLKADOT CUTLERY SET
73,SET/6 RED SPOTTY PAPER PLATES
74,LUNCH BAG RED RETROSPOT
75,STRAWBERRY LUNCH BOX WITH CUTLERY
76,LUNCH BOX WITH CUTLERY RETROSPOT 
77,PACK OF 72 RETROSPOT CAKE CASES
78,PACK OF 60 DINOSAUR CAKE CASES
79,PACK OF 60 PINK PAISLEY CAKE CASES
80,60 TEATIME FAIRY CAKE CASES
81,TOMATO CHARLIE+LOLA COASTER SET
82,CHARLIE & LOLA WASTEPAPER BIN FLORA
83,RED CHARLIE+LOLA PERSONAL DOORSIGN
85,JUMBO STORAGE BAG SUKI
86,JUMBO BAG PINK VINTAGE PAISLEY
87,JAM MAKING SET PRINTED
88,RETROSPOT TEA SET CERAMIC 11 PC 
89,GIRLY PINK TOOL SET
92,JUMBO SHOPPER VINTAGE RED PAISLEY
93,"AIRLINE LOUNGE,METAL SIGN"
94,WHITE SPOT RED CERAMIC DRAWER KNOB
95,RED DRAWER KNOB ACRYLIC EDWARDIAN
96,CLEAR DRAWER KNOB ACRYLIC EDWARDIAN
97,PHOTO CLIP LINE
99,FELT EGG COSY CHICKEN
100,PIGGY BANK RETROSPOT 
101,SKULL SHOULDER BAG
102,YOU'RE CONFUSING ME METAL SIGN 
103,COOK WITH WINE METAL SIGN 
104,GIN + TONIC DIET METAL SIGN
105,YELLOW BREAKFAST CUP AND SAUCER
106,PINK BREAKFAST CUP AND SAUCER 
107,PAPER CHAIN KIT RETROSPOT
108,SMALL HEART FLOWERS HOOK 
110,TEA TIME DES TEA COSY
111,FELT EGG COSY WHITE RABBIT 
112,ZINC WILLIE WINKIE  CANDLE STICK
113,CERAMIC CHERRY CAKE MONEY BANK
116,RETROSPOT LARGE MILK JUG
117,SET OF 6 FUNKY BEAKERS
118,EDWARDIAN PARASOL BLACK
119,EDWARDIAN PARASOL NATURAL
121,CERAMIC STRAWBERRY CAKE MONEY BANK
122,BLUE OWL SOFT TOY
123,BALLOON ART MAKE YOUR OWN FLOWERS
125,GLASS CLOCHE SMALL
126,GUMBALL MONOCHROME COAT RACK
128,DOORMAT FANCY FONT HOME SWEET HOME
129,VINTAGE SNAKES & LADDERS
132,CHOCOLATE CALCULATOR
135,RECYCLING BAG RETROSPOT 
137,TOY TIDY PINK POLKADOT
140,ANTIQUE GLASS DRESSING TABLE POT
141,IVORY GIANT GARDEN THERMOMETER
144,3 TIER CAKE TIN GREEN AND CREAM
145,3 TIER CAKE TIN RED AND CREAM
146,SET 3 WICKER OVAL BASKETS W LIDS
147,SET OF 3 COLOURED  FLYING DUCKS
148,WOOD BLACK BOARD ANT WHITE FINISH
149,COLOUR GLASS T-LIGHT HOLDER HANGING
150,HANGING METAL HEART LANTERN
151,HANGING MEDINA LANTERN SMALL
152,NATURAL SLATE HEART CHALKBOARD 
153,HEART OF WICKER SMALL
154,HEART OF WICKER LARGE
155,WHITE LOVEBIRD LANTERN
156,CLASSIC METAL BIRDCAGE PLANT HOLDER
157,CREAM HEART CARD HOLDER
158,ENAMEL FLOWER JUG CREAM
159,ENAMEL FIRE BUCKET CREAM
160,ENAMEL BREAD BIN CREAM
161,JUMBO BAG DOLLY GIRL DESIGN
162,TRADITIONAL CHRISTMAS RIBBONS
163,ORGANISER WOOD ANTIQUE WHITE 
164,LUNCH BAG DOLLY GIRL DESIGN
165,WHITE WIRE EGG HOLDER
166,JUMBO BAG RED RETROSPOT
168,CHILLI LIGHTS
169,LIGHT GARLAND BUTTERFILES PINK
170,WOODEN OWLS LIGHT GARLAND 
171,FAIRY TALE COTTAGE NIGHTLIGHT
172,HOME SMALL WOOD LETTERS
173,GINGHAM HEART  DOORSTOP RED
174,FIVE HEART HANGING DECORATION
175,ASSORTED BOTTLE TOP  MAGNETS 
176,FRIDGE MAGNETS US DINER ASSORTED
177,HOMEMADE JAM SCENTED CANDLES
178,FRIDGE MAGNETS LES ENFANTS ASSORTED
179,ROSE CARAVAN DOORSTOP
180,5 HOOK HANGER MAGIC TOADSTOOL
181,CHRISTMAS LIGHTS 10 REINDEER
183,VINTAGE UNION JACK CUSHION COVER
184,SET OF 3 GOLD FLYING DUCKS
185,RED RETROSPOT UMBRELLA
186,BLACK/BLUE POLKADOT UMBRELLA
187,RED DINER WALL CLOCK
188,BLUE DINER WALL CLOCK
189,IVORY DINER WALL CLOCK
190,LARGE HEART MEASURING SPOONS
191,SMALL HEART MEASURING SPOONS
193,JAM JAR WITH PINK LID
194,JAM JAR WITH GREEN LID
195,ROSE COTTAGE KEEPSAKE BOX 
196,HANGING HEART ZINC T-LIGHT HOLDER
198,PAPER CHAIN KIT VINTAGE CHRISTMAS
199,DISCO BALL CHRISTMAS DECORATION
201,SMALL POPCORN HOLDER
202,LARGE POPCORN HOLDER 
203,SET/20 RED RETROSPOT PAPER NAPKINS 
204,SET/6 RED SPOTTY PAPER CUPS
205,POLKADOT RAIN HAT 
206,DELUXE SEWING KIT 
207,RETROSPOT HEART HOT WATER BOTTLE
208,ENGLISH ROSE HOT WATER BOTTLE
209,PHOTO CUBE
210,PLASTERS IN TIN CIRCUS PARADE 
211,PACK OF 12 PINK PAISLEY TISSUES 
212,PACK OF 12 BLUE PAISLEY TISSUES 
213,PACK OF 12 RED RETROSPOT TISSUES 
214,CHICK GREY HOT WATER BOTTLE
215,PLASTERS IN TIN VINTAGE PAISLEY 
216,PLASTERS IN TIN SKULLS
217,3 STRIPEY MICE FELTCRAFT
218,SET OF 6 SOLDIER SKITTLES
219,TRADITIONAL WOODEN SKIPPING ROPE
220,WOODEN BOX OF DOMINOES
222,RUSTIC  SEVENTEEN DRAWER SIDEBOARD
223,PARTY CONES CARNIVAL ASSORTED
224,PARTY CONES CANDY ASSORTED
225,PICNIC BASKET WICKER SMALL
227,STAR DECORATION PAINTED ZINC 
228,RETROSPOT LAMP
229,"FANCY FONT BIRTHDAY CARD, "
230,HAND WARMER SCOTTY DOG DESIGN
231,HAND WARMER OWL DESIGN
232,HAND WARMER RED RETROSPOT
233,DOG BOWL CHASING BALL DESIGN
234,CLOTHES PEGS RETROSPOT PACK 24 
235,HAND OVER THE CHOCOLATE   SIGN 
236,TRAVEL SEWING KIT
237,BLACK HEART CARD HOLDER
238,SMALL GLASS HEART TRINKET POT
239,ALARM CLOCK BAKELIKE IVORY
240,ALARM CLOCK BAKELIKE ORANGE
241,HAND WARMER BIRD DESIGN
242,IVORY EMBROIDERED QUILT 
243,SET OF 3 BLACK FLYING DUCKS
246,RED RETROSPOT MUG
247,BABUSHKA LIGHTS STRING OF 10
248,DOORMAT FAIRY CAKE
249,STRAWBERRY CERAMIC TRINKET BOX
250,PINK DOUGHNUT TRINKET POT 
251,SILK PURSE BABUSHKA PINK
252,HOT WATER BOTTLE I AM SO POORLY
253,CHOCOLATE HOT WATER BOTTLE
254,WHITE SKULL HOT WATER BOTTLE 
255,SCOTTIE DOG HOT WATER BOTTLE
256,BIRD HOUSE HOT WATER BOTTLE
257,BOUDOIR SQUARE TISSUE BOX
258,SKULLS SQUARE TISSUE BOX
259,PHOTO FRAME CORNICE
260,SILK PURSE BABUSHKA RED
261,PICTURE DOMINOES
262,S/6 SEW ON CROCHET FLOWERS
263,SCANDINAVIAN REDS RIBBONS
265,BALLOONS  WRITING SET 
266,LAVENDER INCENSE IN TIN
267,TV DINNER TRAY VINTAGE PAISLEY
269,SET OF 4 ENGLISH ROSE PLACEMATS
270,SET OF 4 ENGLISH ROSE COASTERS
271,TRIPLE PHOTO FRAME CORNICE 
272,FAMILY PHOTO FRAME CORNICE
273,MIRRORED DISCO BALL 
274,DISCO BALL ROTATOR BATTERY OPERATED
275,SILVER LOOKING MIRROR
276,LADIES & GENTLEMEN METAL SIGN
277,METAL SIGN HER DINNER IS SERVED 
278,DOORMAT TOPIARY
279,BATHROOM METAL SIGN
280,KITCHEN METAL SIGN
281,TOILET METAL SIGN
282,METAL SIGN TAKE IT OR LEAVE IT 
283,I'M ON HOLIDAY METAL SIGN
284,GROW YOUR OWN BASIL IN ENAMEL MUG
285,SET/10 PINK POLKADOT PARTY CANDLES
287,SET 20 NAPKINS FAIRY CAKES DESIGN 
288,SET OF 6 T-LIGHTS SNOWMEN
289,SET OF 6 T-LIGHTS SANTA
290,SET OF 9 HEART SHAPED BALLOONS
291,SANDWICH BATH SPONGE
292,APPLE BATH SPONGE
293,STRAWBERRY BATH SPONGE 
294,BLACK PIRATE TREASURE CHEST
295,STAR PORTABLE TABLE LIGHT 
296,SNOWFLAKE PORTABLE TABLE LIGHT 
298,PINK OVAL JEWELLED MIRROR
299,RETROSPOT CIGAR BOX MATCHES 
300,COSY HOUR GIANT TUBE MATCHES
301,JAZZ HEARTS PURSE NOTEBOOK
302,CANDLEHOLDER PINK HANGING HEART
303,ASSORTED COLOUR MINI CASES
304,LUNCH BAG SPACEBOY DESIGN 
305,LUNCH BAG WOODLAND
306,LUNCH BAG PINK POLKADOT
307,GUMBALL COAT RACK
308,BLUE NEW BAROQUE CANDLESTICK CANDLE
310,PINK NEW BAROQUECANDLESTICK CANDLE
311,FAIRY CAKE FLANNEL ASSORTED COLOUR
312,BREAD BIN DINER STYLE PINK
313,TEA TIME TABLE CLOTH
314,HOT WATER BOTTLE BABUSHKA 
315,HEART IVORY TRELLIS SMALL
316,PINK DRAWER KNOB ACRYLIC EDWARDIAN
317,GREEN DRAWER KNOB ACRYLIC EDWARDIAN
318,BLUE DRAWER KNOB ACRYLIC EDWARDIAN
319,SET 6 FOOTBALL CELEBRATION CANDLES
320,SET OF 6 GIRLS CELEBRATION CANDLES
321,ROMANTIC PINKS RIBBONS 
322,BRIGHT BLUES RIBBONS 
324,CHOCOLATE BOX RIBBONS 
325,PARTY INVITES FOOTBALL
326,PARTY INVITES JAZZ HEARTS
327,PARTY INVITES SPACEMAN
328,SET OF 3 BUTTERFLY COOKIE CUTTERS
329,SET OF 3 HEART COOKIE CUTTERS
330,3 PIECE SPACEBOY COOKIE CUTTER SET
331,PACK OF 72 SKULL CAKE CASES
332,PACK OF 60 SPACEBOY CAKE CASES
333,72 SWEETHEART FAIRY CAKE CASES
334,LUNCH BAG SUKI  DESIGN 
335,LUNCH BAG CARS BLUE
336,LUNCH BAG  BLACK SKULL.
337,HEART IVORY TRELLIS LARGE
338,SET/5 RED RETROSPOT LID GLASS BOWLS
339,MAGIC DRAWING SLATE DINOSAUR
340,MAGIC DRAWING SLATE BAKE A CAKE 
341,12 PENCILS TALL TUBE SKULLS
342,RED  HARMONICA IN BOX 
343,BLUE HARMONICA IN BOX 
344,SKULLS  WATER TRANSFER TATTOOS 
345,PACK 3 BOXES BIRD PANNETONE 
346,SET OF 20 KIDS COOKIE CUTTERS
347,10 COLOUR SPACEBOY PEN
348,VICTORIAN GLASS HANGING T-LIGHT
349,SINGLE HEART ZINC T-LIGHT HOLDER
350,HANGING METAL STAR LANTERN
351,SILVER HANGING T-LIGHT HOLDER
352,DOORMAT RED RETROSPOT
353,DOORMAT HEARTS
354,NATURAL SLATE RECTANGLE CHALKBOARD
355,LOVEBIRD HANGING DECORATION WHITE 
356,PENS ASSORTED FUNNY FACE
357,CARD CIRCUS PARADE
358,WRAP COWBOYS  
359,AIRLINE BAG VINTAGE TOKYO 78
360,SET OF 72 RETROSPOT PAPER  DOILIES
361,SLEEPING CAT ERASERS
362,CARD BIRTHDAY COWBOY
363,PACK 3 BOXES CHRISTMAS PANNETONE
364,ROTATING SILVER ANGELS T-LIGHT HLDR
365,RIBBON REEL MAKING SNOWMEN 
366,4 TRADITIONAL SPINNING TOPS
367,BAG 500g SWIRLY MARBLES
368,5 STRAND GLASS NECKLACE CRYSTAL
369,SQUARECUSHION COVER PINK UNION FLAG
370,SPACEBOY CHILDRENS EGG CUP
371,CHILDREN'S SPACEBOY MUG
372,FELTCRAFT CUSHION OWL
373,BLACK CANDELABRA T-LIGHT HOLDER
374,TOY TIDY DOLLY GIRL DESIGN
376,SET 12 LAVENDER  BOTANICAL T-LIGHTS
377,UNION JACK FLAG LUGGAGE TAG
378,RED HEART LUGGAGE TAG
379,RED GLASS TASSLE BAG CHARM
380,CLEAR ACRYLIC FACETED BANGLE
381,DOORMAT UNION JACK GUNS AND ROSES
382,VANILLA SCENT CANDLE JEWELLED BOX
383,FULL ENGLISH BREAKFAST PLATE
384,MAGIC DRAWING SLATE CIRCUS PARADE  
385,CHRISTMAS HANGING HEART WITH BELL
386,CAKE STAND VICTORIAN FILIGREE MED
387,PAISLEY PATTERN  STICKERS
388,FLOWERS  STICKERS
389,BLACK LOVE BIRD CANDLE
390,PARTY TIME PENCIL ERASERS
391,PINK B'FLY C/COVER W BOBBLES
393,PINK UNION JACK  LUGGAGE TAG
405,6 RIBBONS ELEGANT CHRISTMAS 
406,AGED GLASS SILVER T-LIGHT HOLDER
407,BOOM BOX SPEAKER GIRLS
408,6 RIBBONS SHIMMERING PINKS 
409,JUMBO BAG OWLS
410,OWL DOORSTOP
412,PAINTED METAL STAR WITH HOLLY BELLS
413,PAINTED METAL HEART WITH HOLLY BELL
414,ANGEL DECORATION STARS ON DRESS
415,JUMBO BAG STRAWBERRY
416,STRAWBERRY SHOPPER BAG
417,ROUND SNACK BOXES SET OF 4 FRUITS 
418,ROUND SNACK BOXES SET OF 4 SKULLS
419,DOLLY GIRL LUNCH BOX
420,GREEN POLKADOT PLATE 
421,BLUE POLKADOT PLATE 
422,RED RETROSPOT PLATE 
423,PINK  POLKADOT PLATE 
424,FELTCRAFT DOLL MOLLY
425,FELTCRAFT CHRISTMAS FAIRY
426,SET OF 3 NOTEBOOKS IN PARCEL
427,RED RETROSPOT TAPE
428,COSY SLIPPER SHOES SMALL  RED 
429,6 RIBBONS RUSTIC CHARM
430,12 DAISY PEGS IN WOOD BOX
431,5 HOOK HANGER RED MAGIC TOADSTOOL
432,CHRISTMAS CRAFT TREE TOP ANGEL
433,CHRISTMAS CRAFT LITTLE FRIENDS
434,COSY SLIPPER SHOES SMALL GREEN
435,FELTCRAFT DOLL ROSIE
436,FELTCRAFT DOLL EMILY
437,FELTCRAFT PRINCESS OLIVIA DOLL
438,REX CASH+CARRY JUMBO SHOPPER
440,FELTCRAFT CUSHION RABBIT
441,FELTCRAFT CUSHION BUTTERFLY
442,TOTE BAG I LOVE LONDON
444,FOLDING UMBRELLA PINKWHITE POLKADOT
445,FOLDING UMBRELLA CREAM POLKADOT
446,FOLDING UMBRELLA WHITE/RED POLKADOT
448,SET 10 LIGHTS NIGHT OWL
449,FOLDING UMBRELLA RED/WHITE POLKADOT
450,S/4 VALENTINE DECOUPAGE HEART BOX
451,SOLDIERS EGG CUP 
452,RED RETROSPOT MINI CASES
453,60 CAKE CASES VINTAGE CHRISTMAS
454,RIBBON REEL CHRISTMAS SOCK BAUBLE
455,RIBBON REEL SNOWY VILLAGE
456,SET OF 20 VINTAGE CHRISTMAS NAPKINS
457,TURQUOISE CHRISTMAS TREE 
458,RED STAR CARD HOLDER
459,WICKER WREATH SMALL
460,ADVENT CALENDAR GINGHAM SACK
461,FELTCRAFT BUTTERFLY HEARTS
464,PARTY CONE CHRISTMAS DECORATION 
466,WICKER STAR 
467,VINTAGE SNAP CARDS
468,FELTCRAFT 6 FLOWER FRIENDS
469,BIRD DECORATION RED RETROSPOT
470,CHRISTMAS GINGHAM TREE
471,CHRISTMAS GINGHAM STAR
472,CHRISTMAS GINGHAM HEART
473,PACK OF 12 PINK POLKADOT TISSUES
474,FELTCRAFT PRINCESS LOLA DOLL
475,PACK OF 12 LONDON TISSUES 
476,PURPLE DRAWERKNOB ACRYLIC EDWARDIAN
477,CHILDREN'S APRON DOLLY GIRL 
478,CHILDRENS APRON SPACEBOY DESIGN
479,CHRISTMAS LIGHTS 10 SANTAS 
480,PACK OF 60 MUSHROOM CAKE CASES
481,60 CAKE CASES DOLLY GIRL DESIGN
482,HAND WARMER BABUSHKA DESIGN
484,SET 12 RETRO WHITE CHALK STICKS
485,FELTCRAFT HAIRBAND RED AND BLUE
486,FELTCRAFT HAIRBAND PINK AND PURPLE
487,FELTCRAFT HAIRBANDS PINK AND WHITE 
488,TV DINNER TRAY DOLLY GIRL
489,PLASTERS IN TIN SPACEBOY
490,PLASTERS IN TIN WOODLAND ANIMALS
491,MAGIC DRAWING SLATE SPACEBOY 
492,MAGIC DRAWING SLATE GO TO THE FAIR 
493,MAGIC DRAWING SLATE DOLLY GIRL 
494,CHARLIE + LOLA RED HOT WATER BOTTLE
495,URBAN BLACK RIBBONS 
496,SET OF 6 T-LIGHTS TOADSTOOLS
497,ROTATING LEAVES T-LIGHT HOLDER
499,CUPCAKE LACE PAPER SET 6
500,TRADITIONAL WOODEN CATCH CUP GAME 
